[0.028s] Invoking command in '/root/ws/tutorial/ros2_ws/build/examples_rclcpp_multithreaded_executor': AMENT_PREFIX_PATH=/root/ws/tutorial/ros2_ws/install/examples_rclcpp_multithreaded_executor:${AMENT_PREFIX_PATH} CMAKE_PREFIX_PATH=/root/ws/tutorial/ros2_ws/install/examples_rclcpp_multithreaded_executor:${CMAKE_PREFIX_PATH} /usr/bin/ctest -C Release -D ExperimentalTest --no-compress-output -V --force-new-ctest-process
[0.038s] UpdateCTestConfiguration  from :/root/ws/tutorial/ros2_ws/build/examples_rclcpp_multithreaded_executor/CTestConfiguration.ini
[0.038s] Parse Config file:/root/ws/tutorial/ros2_ws/build/examples_rclcpp_multithreaded_executor/CTestConfiguration.ini
[0.039s]    Site: IRS-RASCL02
[0.039s]    Build name: (empty)
[0.041s]  Add coverage exclude regular expressions.
[0.042s] Create new tag: 20251210-1525 - Experimental
[0.042s] UpdateCTestConfiguration  from :/root/ws/tutorial/ros2_ws/build/examples_rclcpp_multithreaded_executor/CTestConfiguration.ini
[0.042s] Parse Config file:/root/ws/tutorial/ros2_ws/build/examples_rclcpp_multithreaded_executor/CTestConfiguration.ini
[0.042s] Test project /root/ws/tutorial/ros2_ws/build/examples_rclcpp_multithreaded_executor
[0.043s] Constructing a list of tests
[0.043s] Done constructing a list of tests
[0.043s] Updating test list for fixtures
[0.044s] Added 0 tests to meet fixture requirements
[0.044s] Checking test dependency graph...
[0.044s] Checking test dependency graph end
[0.044s] test 1
[0.044s]     Start 1: copyright
[0.044s] 
[0.045s] 1: Test command: /usr/bin/python3 "-u" "/opt/ros/jazzy/share/ament_cmake_test/cmake/run_test.py" "/root/ws/tutorial/ros2_ws/build/examples_rclcpp_multithreaded_executor/test_results/examples_rclcpp_multithreaded_executor/copyright.xunit.xml" "--package-name" "examples_rclcpp_multithreaded_executor" "--output-file" "/root/ws/tutorial/ros2_ws/build/examples_rclcpp_multithreaded_executor/ament_copyright/copyright.txt" "--command" "/opt/ros/jazzy/bin/ament_copyright" "--xunit-file" "/root/ws/tutorial/ros2_ws/build/examples_rclcpp_multithreaded_executor/test_results/examples_rclcpp_multithreaded_executor/copyright.xunit.xml"
[0.045s] 1: Working Directory: /root/ws/tutorial/ros2_ws/src/examples/rclcpp/executors/multithreaded_executor
[0.045s] 1: Test timeout computed to be: 200
[0.113s] 1: -- run_test.py: invoking following command in '/root/ws/tutorial/ros2_ws/src/examples/rclcpp/executors/multithreaded_executor':
[0.113s] 1:  - /opt/ros/jazzy/bin/ament_copyright --xunit-file /root/ws/tutorial/ros2_ws/build/examples_rclcpp_multithreaded_executor/test_results/examples_rclcpp_multithreaded_executor/copyright.xunit.xml
[0.289s] 1: No problems found, checked 1 files
[0.308s] 1: -- run_test.py: return code 0
[0.308s] 1: -- run_test.py: verify result file '/root/ws/tutorial/ros2_ws/build/examples_rclcpp_multithreaded_executor/test_results/examples_rclcpp_multithreaded_executor/copyright.xunit.xml'
[0.320s] 1/6 Test #1: copyright ........................   Passed    0.27 sec
[0.320s] test 2
[0.320s]     Start 2: cppcheck
[0.320s] 
[0.322s] 2: Test command: /usr/bin/python3 "-u" "/opt/ros/jazzy/share/ament_cmake_test/cmake/run_test.py" "/root/ws/tutorial/ros2_ws/build/examples_rclcpp_multithreaded_executor/test_results/examples_rclcpp_multithreaded_executor/cppcheck.xunit.xml" "--package-name" "examples_rclcpp_multithreaded_executor" "--output-file" "/root/ws/tutorial/ros2_ws/build/examples_rclcpp_multithreaded_executor/ament_cppcheck/cppcheck.txt" "--command" "/opt/ros/jazzy/bin/ament_cppcheck" "--xunit-file" "/root/ws/tutorial/ros2_ws/build/examples_rclcpp_multithreaded_executor/test_results/examples_rclcpp_multithreaded_executor/cppcheck.xunit.xml"
[0.322s] 2: Working Directory: /root/ws/tutorial/ros2_ws/src/examples/rclcpp/executors/multithreaded_executor
[0.323s] 2: Test timeout computed to be: 300
[0.388s] 2: -- run_test.py: invoking following command in '/root/ws/tutorial/ros2_ws/src/examples/rclcpp/executors/multithreaded_executor':
[0.388s] 2:  - /opt/ros/jazzy/bin/ament_cppcheck --xunit-file /root/ws/tutorial/ros2_ws/build/examples_rclcpp_multithreaded_executor/test_results/examples_rclcpp_multithreaded_executor/cppcheck.xunit.xml
[0.482s] 2: cppcheck 2.13.0 has known performance issues and therefore will not be used, set the AMENT_CPPCHECK_ALLOW_SLOW_VERSIONS environment variable to override this.
[0.503s] 2: -- run_test.py: return code 0
[0.503s] 2: -- run_test.py: verify result file '/root/ws/tutorial/ros2_ws/build/examples_rclcpp_multithreaded_executor/test_results/examples_rclcpp_multithreaded_executor/cppcheck.xunit.xml'
[0.517s] 2/6 Test #2: cppcheck .........................   Passed    0.19 sec
[0.518s] test 3
[0.518s]     Start 3: cpplint
[0.518s] 
[0.518s] 3: Test command: /usr/bin/python3 "-u" "/opt/ros/jazzy/share/ament_cmake_test/cmake/run_test.py" "/root/ws/tutorial/ros2_ws/build/examples_rclcpp_multithreaded_executor/test_results/examples_rclcpp_multithreaded_executor/cpplint.xunit.xml" "--package-name" "examples_rclcpp_multithreaded_executor" "--output-file" "/root/ws/tutorial/ros2_ws/build/examples_rclcpp_multithreaded_executor/ament_cpplint/cpplint.txt" "--command" "/opt/ros/jazzy/bin/ament_cpplint" "--xunit-file" "/root/ws/tutorial/ros2_ws/build/examples_rclcpp_multithreaded_executor/test_results/examples_rclcpp_multithreaded_executor/cpplint.xunit.xml"
[0.518s] 3: Working Directory: /root/ws/tutorial/ros2_ws/src/examples/rclcpp/executors/multithreaded_executor
[0.518s] 3: Test timeout computed to be: 120
[0.582s] 3: -- run_test.py: invoking following command in '/root/ws/tutorial/ros2_ws/src/examples/rclcpp/executors/multithreaded_executor':
[0.582s] 3:  - /opt/ros/jazzy/bin/ament_cpplint --xunit-file /root/ws/tutorial/ros2_ws/build/examples_rclcpp_multithreaded_executor/test_results/examples_rclcpp_multithreaded_executor/cpplint.xunit.xml
[0.722s] 3: Using '--root=..' argument
[0.722s] 3: 
[0.722s] 3: Done processing /root/ws/tutorial/ros2_ws/src/examples/rclcpp/executors/multithreaded_executor/multithreaded_executor.cpp
[0.722s] 3: 
[0.722s] 3: No problems found
[0.740s] 3: -- run_test.py: return code 0
[0.741s] 3: -- run_test.py: verify result file '/root/ws/tutorial/ros2_ws/build/examples_rclcpp_multithreaded_executor/test_results/examples_rclcpp_multithreaded_executor/cpplint.xunit.xml'
[0.753s] 3/6 Test #3: cpplint ..........................   Passed    0.24 sec
[0.753s] test 4
[0.753s]     Start 4: lint_cmake
[0.753s] 
[0.753s] 4: Test command: /usr/bin/python3 "-u" "/opt/ros/jazzy/share/ament_cmake_test/cmake/run_test.py" "/root/ws/tutorial/ros2_ws/build/examples_rclcpp_multithreaded_executor/test_results/examples_rclcpp_multithreaded_executor/lint_cmake.xunit.xml" "--package-name" "examples_rclcpp_multithreaded_executor" "--output-file" "/root/ws/tutorial/ros2_ws/build/examples_rclcpp_multithreaded_executor/ament_lint_cmake/lint_cmake.txt" "--command" "/opt/ros/jazzy/bin/ament_lint_cmake" "--xunit-file" "/root/ws/tutorial/ros2_ws/build/examples_rclcpp_multithreaded_executor/test_results/examples_rclcpp_multithreaded_executor/lint_cmake.xunit.xml"
[0.754s] 4: Working Directory: /root/ws/tutorial/ros2_ws/src/examples/rclcpp/executors/multithreaded_executor
[0.754s] 4: Test timeout computed to be: 60
[0.821s] 4: -- run_test.py: invoking following command in '/root/ws/tutorial/ros2_ws/src/examples/rclcpp/executors/multithreaded_executor':
[0.821s] 4:  - /opt/ros/jazzy/bin/ament_lint_cmake --xunit-file /root/ws/tutorial/ros2_ws/build/examples_rclcpp_multithreaded_executor/test_results/examples_rclcpp_multithreaded_executor/lint_cmake.xunit.xml
[0.912s] 4: 
[0.912s] 4: No problems found
[0.930s] 4: -- run_test.py: return code 0
[0.932s] 4: -- run_test.py: verify result file '/root/ws/tutorial/ros2_ws/build/examples_rclcpp_multithreaded_executor/test_results/examples_rclcpp_multithreaded_executor/lint_cmake.xunit.xml'
[0.941s] 4/6 Test #4: lint_cmake .......................   Passed    0.19 sec
[0.941s] test 5
[0.941s]     Start 5: uncrustify
[0.941s] 
[0.941s] 5: Test command: /usr/bin/python3 "-u" "/opt/ros/jazzy/share/ament_cmake_test/cmake/run_test.py" "/root/ws/tutorial/ros2_ws/build/examples_rclcpp_multithreaded_executor/test_results/examples_rclcpp_multithreaded_executor/uncrustify.xunit.xml" "--package-name" "examples_rclcpp_multithreaded_executor" "--output-file" "/root/ws/tutorial/ros2_ws/build/examples_rclcpp_multithreaded_executor/ament_uncrustify/uncrustify.txt" "--command" "/opt/ros/jazzy/bin/ament_uncrustify" "--xunit-file" "/root/ws/tutorial/ros2_ws/build/examples_rclcpp_multithreaded_executor/test_results/examples_rclcpp_multithreaded_executor/uncrustify.xunit.xml"
[0.941s] 5: Working Directory: /root/ws/tutorial/ros2_ws/src/examples/rclcpp/executors/multithreaded_executor
[0.941s] 5: Test timeout computed to be: 60
[1.009s] 5: -- run_test.py: invoking following command in '/root/ws/tutorial/ros2_ws/src/examples/rclcpp/executors/multithreaded_executor':
[1.009s] 5:  - /opt/ros/jazzy/bin/ament_uncrustify --xunit-file /root/ws/tutorial/ros2_ws/build/examples_rclcpp_multithreaded_executor/test_results/examples_rclcpp_multithreaded_executor/uncrustify.xunit.xml
[1.115s] 5: No code style divergence in file 'multithreaded_executor.cpp'
[1.116s] 5: 
[1.116s] 5: No problems found
[1.133s] 5: -- run_test.py: return code 0
[1.133s] 5: -- run_test.py: verify result file '/root/ws/tutorial/ros2_ws/build/examples_rclcpp_multithreaded_executor/test_results/examples_rclcpp_multithreaded_executor/uncrustify.xunit.xml'
[1.145s] 5/6 Test #5: uncrustify .......................   Passed    0.20 sec
[1.145s] test 6
[1.145s]     Start 6: xmllint
[1.145s] 
[1.146s] 6: Test command: /usr/bin/python3 "-u" "/opt/ros/jazzy/share/ament_cmake_test/cmake/run_test.py" "/root/ws/tutorial/ros2_ws/build/examples_rclcpp_multithreaded_executor/test_results/examples_rclcpp_multithreaded_executor/xmllint.xunit.xml" "--package-name" "examples_rclcpp_multithreaded_executor" "--output-file" "/root/ws/tutorial/ros2_ws/build/examples_rclcpp_multithreaded_executor/ament_xmllint/xmllint.txt" "--command" "/opt/ros/jazzy/bin/ament_xmllint" "--xunit-file" "/root/ws/tutorial/ros2_ws/build/examples_rclcpp_multithreaded_executor/test_results/examples_rclcpp_multithreaded_executor/xmllint.xunit.xml"
[1.146s] 6: Working Directory: /root/ws/tutorial/ros2_ws/src/examples/rclcpp/executors/multithreaded_executor
[1.146s] 6: Test timeout computed to be: 60
[1.212s] 6: -- run_test.py: invoking following command in '/root/ws/tutorial/ros2_ws/src/examples/rclcpp/executors/multithreaded_executor':
[1.212s] 6:  - /opt/ros/jazzy/bin/ament_xmllint --xunit-file /root/ws/tutorial/ros2_ws/build/examples_rclcpp_multithreaded_executor/test_results/examples_rclcpp_multithreaded_executor/xmllint.xunit.xml
[1.520s] 6: File 'package.xml' is valid
[1.520s] 6: 
[1.520s] 6: No problems found
[1.541s] 6: -- run_test.py: return code 0
[1.542s] 6: -- run_test.py: verify result file '/root/ws/tutorial/ros2_ws/build/examples_rclcpp_multithreaded_executor/test_results/examples_rclcpp_multithreaded_executor/xmllint.xunit.xml'
[1.562s] 6/6 Test #6: xmllint ..........................   Passed    0.41 sec
[1.562s] 
[1.562s] [0;32m100% tests passed[0;0m, 0 tests failed[0;0m out of 6
[1.562s] 
[1.562s] Label Time Summary:
[1.562s] copyright     =   0.27 sec*proc (1 test)
[1.562s] cppcheck      =   0.19 sec*proc (1 test)
[1.563s] cpplint       =   0.24 sec*proc (1 test)
[1.563s] lint_cmake    =   0.19 sec*proc (1 test)
[1.563s] linter        =   1.50 sec*proc (6 tests)
[1.563s] uncrustify    =   0.20 sec*proc (1 test)
[1.563s] xmllint       =   0.41 sec*proc (1 test)
[1.563s] 
[1.563s] Total Test time (real) =   1.51 sec
[1.566s] Invoked command in '/root/ws/tutorial/ros2_ws/build/examples_rclcpp_multithreaded_executor' returned '0': AMENT_PREFIX_PATH=/root/ws/tutorial/ros2_ws/install/examples_rclcpp_multithreaded_executor:${AMENT_PREFIX_PATH} CMAKE_PREFIX_PATH=/root/ws/tutorial/ros2_ws/install/examples_rclcpp_multithreaded_executor:${CMAKE_PREFIX_PATH} /usr/bin/ctest -C Release -D ExperimentalTest --no-compress-output -V --force-new-ctest-process
